"MEDICAL_CODE_ID","DESCRIPTION","READ_CODE","SNOMED_CT_CODE","DATABASE"
"1B1b.00","Transient hallucinations","1B1b.00","","IMRD"
"1B1c.00","Alcohol induced hallucinations","1B1c.00","","IMRD"
"1B1d.00","Hypnagogic hallucination","1B1d.00","","IMRD"
"1B1e.00","Hypnopompic hallucination","1B1e.00","","IMRD"
"1B1E.00","Hallucinations","1B1E.00","","IMRD"
"1BH..00","Delusions","1BH..00","","IMRD"
"1BH..11","Delusion","1BH..11","","IMRD"
"1BH0.00","Delusion of persecution","1BH0.00","","IMRD"
"E11..00","Affective psychoses","E11..00","","IMRD"
"E11..11","Bipolar psychoses","E11..11","","IMRD"
"E11..12","Depressive psychoses","E11..12","","IMRD"
"E11..13","Manic psychoses","E11..13","","IMRD"
"E110.00","Manic disorder, single episode","E110.00","","IMRD"
"E110.11","Hypomanic psychoses","E110.11","","IMRD"
"E110000","Single manic episode, unspecified","E110000","","IMRD"
"E110100","Single manic episode, mild","E110100","","IMRD"
"E110200","Single manic episode, moderate","E110200","","IMRD"
"E110300","Single manic episode, severe without mention of psychosis","E110300","","IMRD"
"E110400","Single manic episode, severe, with psychosis","E110400","","IMRD"
"E110500","Single manic episode in partial or unspecified remission","E110500","","IMRD"
"E110600","Single manic episode in full remission","E110600","","IMRD"
"E110z00","Manic disorder, single episode NOS","E110z00","","IMRD"
"E111.00","Recurrent manic episodes","E111.00","","IMRD"
"E111000","Recurrent manic episodes, unspecified","E111000","","IMRD"
"E111100","Recurrent manic episodes, mild","E111100","","IMRD"
"E111200","Recurrent manic episodes, moderate","E111200","","IMRD"
"E111300","Recurrent manic episodes, severe without mention psychosis","E111300","","IMRD"
"E111400","Recurrent manic episodes, severe, with psychosis","E111400","","IMRD"
"E111500","Recurrent manic episodes, partial or unspecified remission","E111500","","IMRD"
"E111600","Recurrent manic episodes, in full remission","E111600","","IMRD"
"E111z00","Recurrent manic episode NOS","E111z00","","IMRD"
"E112.00","Single major depressive episode","E112.00","","IMRD"
"E112.11","Agitated depression","E112.11","","IMRD"
"E112.12","Endogenous depression first episode","E112.12","","IMRD"
"E112.13","Endogenous depression first episode","E112.13","","IMRD"
"E112.14","Endogenous depression","E112.14","","IMRD"
"E112000","Single major depressive episode, unspecified","E112000","","IMRD"
"E112100","Single major depressive episode, mild","E112100","","IMRD"
"E112200","Single major depressive episode, moderate","E112200","","IMRD"
"E112300","Single major depressive episode, severe, without psychosis","E112300","","IMRD"
"E112400","Single major depressive episode, severe, with psychosis","E112400","","IMRD"
"E112500","Single major depressive episode, partial or unspec remission","E112500","","IMRD"
"E112600","Single major depressive episode, in full remission","E112600","","IMRD"
"E112z00","Single major depressive episode NOS","E112z00","","IMRD"
"E113.00","Recurrent major depressive episode","E113.00","","IMRD"
"E113.11","Endogenous depression - recurrent","E113.11","","IMRD"
"E113000","Recurrent major depressive episodes, unspecified","E113000","","IMRD"
"E113100","Recurrent major depressive episodes, mild","E113100","","IMRD"
"E113200","Recurrent major depressive episodes, moderate","E113200","","IMRD"
"E113300","Recurrent major depressive episodes, severe, no psychosis","E113300","","IMRD"
"E113400","Recurrent major depressive episodes, severe, with psychosis","E113400","","IMRD"
"E113500","Recurrent major depressive episodes,partial/unspec remission","E113500","","IMRD"
"E113600","Recurrent major depressive episodes, in full remission","E113600","","IMRD"
"E113700","Recurrent depression","E113700","","IMRD"
"E113z00","Recurrent major depressive episode NOS","E113z00","","IMRD"
"E114.00","Bipolar affective disorder, currently manic","E114.00","","IMRD"
"E114.11","Manic-depressive - now manic","E114.11","","IMRD"
"E114000","Bipolar affective disorder, currently manic, unspecified","E114000","","IMRD"
"E114100","Bipolar affective disorder, currently manic, mild","E114100","","IMRD"
"E114200","Bipolar affective disorder, currently manic, moderate","E114200","","IMRD"
"E114300","Bipolar affect disord, currently manic, severe, no psychosis","E114300","","IMRD"
"E114400","Bipolar affect disord, currently manic,severe with psychosis","E114400","","IMRD"
"E114500","Bipolar affect disord,currently manic, part/unspec remission","E114500","","IMRD"
"E114600","Bipolar affective disorder, currently manic, full remission","E114600","","IMRD"
"E114z00","Bipolar affective disorder, currently manic, NOS","E114z00","","IMRD"
"E115.00","Bipolar affective disorder, currently depressed","E115.00","","IMRD"
"E115.11","Manic-depressive - now depressed","E115.11","","IMRD"
"E115000","Bipolar affective disorder, currently depressed, unspecified","E115000","","IMRD"
"E115100","Bipolar affective disorder, currently depressed, mild","E115100","","IMRD"
"E115200","Bipolar affective disorder, currently depressed, moderate","E115200","","IMRD"
"E115300","Bipolar affect disord, now depressed, severe, no psychosis","E115300","","IMRD"
"E115400","Bipolar affect disord, now depressed, severe with psychosis","E115400","","IMRD"
"E115500","Bipolar affect disord, now depressed, part/unspec remission","E115500","","IMRD"
"E115z00","Bipolar affective disorder, currently depressed, NOS","E115z00","","IMRD"
"E116.00","Mixed bipolar affective disorder","E116.00","","IMRD"
"E116000","Mixed bipolar affective disorder, unspecified","E116000","","IMRD"
"E116100","Mixed bipolar affective disorder, mild","E116100","","IMRD"
"E116200","Mixed bipolar affective disorder, moderate","E116200","","IMRD"
"E116300","Mixed bipolar affective disorder, severe, without psychosis","E116300","","IMRD"
"E116400","Mixed bipolar affective disorder, severe, with psychosis","E116400","","IMRD"
"E116500","Mixed bipolar affective disorder, partial/unspec remission","E116500","","IMRD"
"E116600","Mixed bipolar affective disorder, in full remission","E116600","","IMRD"
"E116z00","Mixed bipolar affective disorder, NOS","E116z00","","IMRD"
"E117.00","Unspecified bipolar affective disorder","E117.00","","IMRD"
"E117000","Unspecified bipolar affective disorder, unspecified","E117000","","IMRD"
"E117100","Unspecified bipolar affective disorder, mild","E117100","","IMRD"
"E117200","Unspecified bipolar affective disorder, moderate","E117200","","IMRD"
"E117300","Unspecified bipolar affective disorder, severe, no psychosis","E117300","","IMRD"
"E117400","Unspecified bipolar affective disorder,severe with psychosis","E117400","","IMRD"
"E117500","Unspecified bipolar affect disord, partial/unspec remission","E117500","","IMRD"
"E117600","Unspecified bipolar affective disorder, in full remission","E117600","","IMRD"
"E117z00","Unspecified bipolar affective disorder, NOS","E117z00","","IMRD"
"E118.00","Seasonal affective disorder","E118.00","","IMRD"
"E11y.00","Other and unspecified manic-depressive psychoses","E11y.00","","IMRD"
"E11y000","Unspecified manic-depressive psychoses","E11y000","","IMRD"
"E11y100","Atypical manic disorder","E11y100","","IMRD"
"E11y200","Atypical depressive disorder","E11y200","","IMRD"
"E11y300","Other mixed manic-depressive psychoses","E11y300","","IMRD"
"E11yz00","Other and unspecified manic-depressive psychoses NOS","E11yz00","","IMRD"
"E11z.00","Other and unspecified affective psychoses","E11z.00","","IMRD"
"E11z000","Unspecified affective psychoses NOS","E11z000","","IMRD"
"E11z100","Rebound mood swings","E11z100","","IMRD"
"E11z200","Masked depression","E11z200","","IMRD"
"E11zz00","Other affective psychosis NOS","E11zz00","","IMRD"
"Eu25.00","[X]Schizoaffective disorders","Eu25.00","","IMRD"
"Eu25000","[X]Schizoaffective disorder, manic type","Eu25000","","IMRD"
"Eu25011","[X]Schizoaffective psychosis, manic type","Eu25011","","IMRD"
"Eu25100","[X]Schizoaffective disorder, depressive type","Eu25100","","IMRD"
"Eu25111","[X]Schizoaffective psychosis, depressive type","Eu25111","","IMRD"
"Eu25200","[X]Schizoaffective disorder, mixed type","Eu25200","","IMRD"
"Eu25y00","[X]Other schizoaffective disorders","Eu25y00","","IMRD"
"Eu25z00","[X]Schizoaffective disorder, unspecified","Eu25z00","","IMRD"
"Eu25z11","[X]Schizoaffective psychosis NOS","Eu25z11","","IMRD"
"Eu30200","[X]Mania with psychotic symptoms","Eu30200","","IMRD"
"Eu31200","[X]Bipolar affect disorder cur epi manic with psychotic symp","Eu31200","","IMRD"
"Eu32300","[X]Severe depressive episode with psychotic symptoms","Eu32300","","IMRD"
"Eu32800","[X]Major depression, severe with psychotic symptoms","Eu32800","","IMRD"
"Eu33311","[X]Endogenous depression with psychotic symptoms","Eu33311","","IMRD"
"F481K00","Visual hallucinations","F481K00","","IMRD"
"R001.00","[D]Hallucinations","R001.00","","IMRD"
"R001000","[D]Hallucinations, auditory","R001000","","IMRD"
"R001100","[D]Hallucinations, gustatory","R001100","","IMRD"
"R001200","[D]Hallucinations, olfactory","R001200","","IMRD"
"R001300","[D]Hallucinations, tactile","R001300","","IMRD"
"R001400","[D]Visual hallucinations","R001400","","IMRD"
"R001z00","[D]Hallucinations NOS","R001z00","","IMRD"
"Ryu5300","[X]Other hallucinations","Ryu5300","","IMRD"
"ZR5..00","Delusions-symptoms-states inventory","ZR5..00","","IMRD"
