"MEDICAL_CODE_ID","DESCRIPTION","READ_CODE","SNOMED_CT_CODE","FREQUENCY","DATABASE"
"G110","Congenital nonprogressive ataxia","G11.0","","0","ICD10"
"G111","Early-onset cerebellar ataxia","G11.1","","0","ICD10"
"G112","Late-onset cerebellar ataxia","G11.2","","0","ICD10"
"G113","Cerebellar ataxia with defective DNA repair","G11.3","","0","ICD10"
"G114","Hereditary spastic paraplegia","G11.4","","0","ICD10"
"G118","Other hereditary ataxias","G11.8","","0","ICD10"
"G119","Hereditary ataxia, unspecified","G11.9","","0","ICD10"
"I070","Tricuspid stenosis","I07.0","","0","ICD10"
"I05","Rheumatic mitral valve diseases","I05","","0","ICD10"
"I050","Mitral stenosis","I05.0","","0","ICD10"
"I051","Rheumatic mitral insufficiency","I05.1","","0","ICD10"
"I052","Mitral stenosis with insufficiency","I05.2","","0","ICD10"
"I058","Other mitral valve diseases","I05.8","","0","ICD10"
"I059","Mitral valve disease, unspecified","I05.9","","0","ICD10"
"I06","Rheumatic aortic valve diseases","I06","","0","ICD10"
"I060","Rheumatic aortic stenosis","I06.0","","0","ICD10"
"I062","Rheumatic aortic stenosis with insufficiency","I06.2","","0","ICD10"
"I068","Other rheumatic aortic valve diseases","I06.8","","0","ICD10"
"I069","Rheumatic aortic valve disease, unspecified","I06.9","","0","ICD10"
"I07","Rheumatic tricuspid valve diseases","I07","","0","ICD10"
"I072","Tricuspid stenosis with insufficiency","I07.2","","0","ICD10"
"I078","Other tricuspid valve diseases","I07.8","","0","ICD10"
"I079","Tricuspid valve disease, unspecified","I07.9","","0","ICD10"
"I08","Multiple valve diseases","I08","","0","ICD10"
"I080","Disorders of both mitral and aortic valves","I08.0","","0","ICD10"
"I081","Disorders of both mitral and tricuspid valves","I08.1","","0","ICD10"
"I082","Disorders of both aortic and tricuspid valves","I08.2","","0","ICD10"
"I083","Combined disorders of mitral, aortic and tricuspid valves","I08.3","","0","ICD10"
"I088","Other multiple valve diseases","I08.8","","0","ICD10"
"I089","Multiple valve disease, unspecified","I08.9","","0","ICD10"
"I091","Rheumatic diseases of endocardium, valve unspecified","I09.1","","0","ICD10"
"I34","Nonrheumatic mitral valve disorders","I34","","0","ICD10"
"I340","Mitral (valve) insufficiency","I34.0","","0","ICD10"
"I341","Mitral (valve) prolapse","I34.1","","0","ICD10"
"I342","Nonrheumatic mitral (valve) stenosis","I34.2","","0","ICD10"
"I348","Other nonrheumatic mitral valve disorders","I34.8","","0","ICD10"
"I349","Nonrheumatic mitral valve disorder, unspecified","I34.9","","0","ICD10"
"I35","Nonrheumatic aortic valve disorders","I35","","0","ICD10"
"I350","Aortic (valve) stenosis","I35.0","","0","ICD10"
"I351","Aortic (valve) insufficiency","I35.1","","0","ICD10"
"I352","Aortic (valve) stenosis with insufficiency","I35.2","","0","ICD10"
"I358","Other aortic valve disorders","I35.8","","0","ICD10"
"I359","Aortic valve disorder, unspecified","I35.9","","0","ICD10"
"I36","Nonrheumatic tricuspid valve disorders","I36","","0","ICD10"
"I360","Nonrheumatic tricuspid (valve) stenosis","I36.0","","0","ICD10"
"I361","Nonrheumatic tricuspid (valve) insufficiency","I36.1","","0","ICD10"
"I362","Nonrheumatic tricuspid (valve) stenosis with insufficiency","I36.2","","0","ICD10"
"I368","Other nonrheumatic tricuspid valve disorders","I36.8","","0","ICD10"
"I369","Nonrheumatic tricuspid valve disorder, unspecified","I36.9","","0","ICD10"
"I37","Pulmonary valve disorders","I37","","0","ICD10"
"I370","Pulmonary valve stenosis","I37.0","","0","ICD10"
"I371","Pulmonary valve insufficiency","I37.1","","0","ICD10"
"I372","Pulmonary valve stenosis with insufficiency","I37.2","","0","ICD10"
"I378","Other pulmonary valve disorders","I37.8","","0","ICD10"
"I379","Pulmonary valve disorder, unspecified","I37.9","","0","ICD10"
"I38X","Endocarditis, valve unspecified","I38","","0","ICD10"
"I39","Endocarditis and heart valve disorders in diseases classified elsewhere","I39","","0","ICD10"
"I390","Mitral valve disorders in diseases classified elsewhere","I39.0","","0","ICD10"
"I391","Aortic valve disorders in diseases classified elsewhere","I39.1","","0","ICD10"
"I392","Tricuspid valve disorders in diseases classified elsewhere","I39.2","","0","ICD10"
"I393","Pulmonary valve disorders in diseases classified elsewhere","I39.3","","0","ICD10"
"I394","Multiple valve disorders in diseases classified elsewhere","I39.4","","0","ICD10"
"I398","Endocarditis, valve unspecified, in diseases classified elsewhere","I39.8","","0","ICD10"
"Q22","Congenital malformations of pulmonary and tricuspid valves","Q22","","0","ICD10"
"Q220","Pulmonary valve atresia","Q22.0","","0","ICD10"
"Q221","Congenital pulmonary valve stenosis","Q22.1","","0","ICD10"
"Q222","Congenital pulmonary valve insufficiency","Q22.2","","0","ICD10"
"Q223","Other congenital malformations of pulmonary valve","Q22.3","","0","ICD10"
"Q224","Congenital tricuspid stenosis","Q22.4","","0","ICD10"
"Q225","Ebstein anomaly","Q22.5","","0","ICD10"
"Q228","Other congenital malformations of tricuspid valve","Q22.8","","0","ICD10"
"Q229","Congenital malformation of tricuspid valve, unspecified","Q22.9","","0","ICD10"
"Q23","Congenital malformations of aortic and mitral valves","Q23","","0","ICD10"
"Q230","Congenital stenosis of aortic valve","Q23.0","","0","ICD10"
"Q231","Congenital insufficiency of aortic valve","Q23.1","","0","ICD10"
"Q232","Congenital mitral stenosis","Q23.2","","0","ICD10"
"Q233","Congenital mitral insufficiency","Q23.3","","0","ICD10"
"Q238","Other congenital malformations of aortic and mitral valves","Q23.8","","0","ICD10"
"Q239","Congenital malformation of aortic and mitral valves, unspecified","Q23.9","","0","ICD10"
"Q243","Pulmonary infundibular stenosis","Q24.3","","0","ICD10"
"Q244","Congenital subaortic stenosis","Q24.4","","0","ICD10"
"Q642","Congenital posterior urethral valves","Q64.2","","0","ICD10"
"T820","Mechanical complication of heart valve prosthesis","T82.0","","0","ICD10"
"T822","Mechanical complication of coronary artery bypass and valve grafts","T82.2","","0","ICD10"
"T826","Infection and inflammatory reaction due to cardiac valve prosthesis","T82.6","","0","ICD10"
"Z952","Presence of prosthetic heart valve","Z95.2","","0","ICD10"
"Z953","Presence of xenogenic heart valve","Z95.3","","0","ICD10"
"Z954","Presence of other heart-valve replacement","Z95.4","","0","ICD10"
