"MEDICAL_CODE_ID","DESCRIPTION","READ_CODE","SNOMED_CT_CODE","DATABASE"
"626","Ear fitting hearing aid","8D23.00","","CPRD_GOLD"
"2876","[V]Fitting or adjustment of hearing aid","ZV53200","","CPRD_GOLD"
"3747","Deaf mutism, NEC","F593.00","","CPRD_GOLD"
"3912","Hearing aid provision","8D2..12","","CPRD_GOLD"
"7344","Fit hearing aid","Z911100","","CPRD_GOLD"
"10170","Hearing aid worn","2DG..00","","CPRD_GOLD"
"10975","Hearing aid requested","8M41.00","","CPRD_GOLD"
"11619","Hearing aid provision","Z9E8100","","CPRD_GOLD"
"17407","Difficulty using hearing aid","Z8B5500","","CPRD_GOLD"
"18148","[V]Presence of external hearing-aid","ZV45G00","","CPRD_GOLD"
"18375","Uses hearing aid","Z8B5311","","CPRD_GOLD"
"19417","Does use hearing aid","Z8B5300","","CPRD_GOLD"
"19694","Insertn bone anchors subcutaneous bone anchored hearing aid","7311A00","","CPRD_GOLD"
"26043","Using British sign language","13ZM.00","","CPRD_GOLD"
"30206","Hearing aid procedure","Z911.00","","CPRD_GOLD"
"30394","Checking hearing aid","Z911500","","CPRD_GOLD"
"30525","Implantation of intracochlear prosthesis","7321000","","CPRD_GOLD"
"31962","Changing hearing aid battery","Z911400","","CPRD_GOLD"
"35178","Unable to use hearing aid","Z8B5200","","CPRD_GOLD"
"36766","Provide body worn hearing aid","8D22.00","","CPRD_GOLD"
"40274","Lip reading training","8E31.00","","CPRD_GOLD"
"42441","Attention to cochlear prosthesis","7321200","","CPRD_GOLD"
"42879","Attention to hearing aid","Z911B00","","CPRD_GOLD"
"43643","Implantation of extracochlear prosthesis","7321100","","CPRD_GOLD"
"44297","Using Makaton sign language","13ZP.00","","CPRD_GOLD"
"45604","[V]Adjustment and management of implanted hearing device","ZV53D00","","CPRD_GOLD"
"46837","Able to use hearing aid","Z8B5100","","CPRD_GOLD"
"47129","Uses hearing loop","2DH0.00","","CPRD_GOLD"
"47475","Hearing aid problem","1C17.00","","CPRD_GOLD"
"49226","Provision of support as signing user","8O0F.00","","CPRD_GOLD"
"51744","Adjust hearing aid settings","Z911300","","CPRD_GOLD"
"52245","Ability to use hearing aid","Z8B5.00","","CPRD_GOLD"
"52853","Replace hearing aid battery","8D24.00","","CPRD_GOLD"
"58046","Listening for feedback whistle of hearing aid","Z911A00","","CPRD_GOLD"
"58523","Using lip-reading","13ZL.00","","CPRD_GOLD"
"58602","Provide head worn hearing aid","8D21.00","","CPRD_GOLD"
"58826","Fit ear mould for existing hearing aid","Z911E00","","CPRD_GOLD"
"59392","Attachment of bone anchored hearing prosthesis","7319.00","","CPRD_GOLD"
"59596","Putting on hearing aid","Z911900","","CPRD_GOLD"
"60528","Provision of support as Makaton user","8O0E.00","","CPRD_GOLD"
"60624","Removal of cochlear prosthesis","7321211","","CPRD_GOLD"
"68636","Placement of hearing implant in middle ear","7317C00","","CPRD_GOLD"
"71827","[X]Deaf mutism, not elsewhere classified","FyuU000","","CPRD_GOLD"
"84365","Placement of hearing implant in external ear","7308400","","CPRD_GOLD"
"89253","Insertion fixtures bone anchored hearing prosthesis Stage 2","7319100","","CPRD_GOLD"
"89462","Interpreter needed - British Sign Language","9NUw.00","","CPRD_GOLD"
"91930","Reduction soft tissue for bone anchored hearing prosthesis","7319200","","CPRD_GOLD"
"93118","Removal of cochlear prosthesis","7321800","","CPRD_GOLD"
"93278","One stage insert fixtures bone anchored hearing prosthesis","7319400","","CPRD_GOLD"
"93446","Attention to hearing implant in middle ear","7317D00","","CPRD_GOLD"
"93722","Turning off hearing aid","Z911800","","CPRD_GOLD"
"95814","Attention to hearing implant in external ear","7308500","","CPRD_GOLD"
"96555","Removal of hearing implant from external ear","7308600","","CPRD_GOLD"
"96589","Interpreter needed - Makaton Sign Language","9NUx.00","","CPRD_GOLD"
"96612","Provision of support as Makaton user","Z37G.00","","CPRD_GOLD"
"96803","[V]Bone anchored hearing aid in situ","ZV45N00","","CPRD_GOLD"
"97300","Switching on hearing aid","Z911700","","CPRD_GOLD"
"97657","Insertion fixtures bone anchored hearing prosthesis Stage 1","7319000","","CPRD_GOLD"
"97761","Attention to fixtures for bone anchored hearing prosthesis","7319300","","CPRD_GOLD"
"98241","Attachment of bone anchored hearing prosthesis NOS","7319z00","","CPRD_GOLD"
"98553","Other specified attachment bone anchored hearing prosthesis","7319y00","","CPRD_GOLD"
"98839","Provision of support as signing user","Z37H.00","","CPRD_GOLD"
"100276","Severe acquired hearing loss","F599.00","","CPRD_GOLD"
"100449","Removal of hearing implant from middle ear","7.32E+03","","CPRD_GOLD"
"100452","Preferred method of communication: British Sign Language","13o6.00","","CPRD_GOLD"
"100654","Profound acquired hearing loss","F59A.00","","CPRD_GOLD"
"100777","Uses British Sign Language interpreter","13o8500","","CPRD_GOLD"
"101755","Fitting external hearing prosthesis bone anchored fixtures","7319500","","CPRD_GOLD"
"101889","Adjustment of cochlear implant processor","Z912.00","","CPRD_GOLD"
"103330","Preferred method of communication: Makaton","13o5.00","","CPRD_GOLD"
"107246","Provision of replacement hearing aid","8D26.00","","CPRD_GOLD"
"107364","Bilateral profound sensorineural hearing loss","F591900","","CPRD_GOLD"
"107607","Profound sensorineural hearing loss","F591B00","","CPRD_GOLD"
"107610","Severe sensorineural hearing loss","F591E00","","CPRD_GOLD"
"108029","First stge ins fixtures for bone anchored hearing prosthesis","7319600","","CPRD_GOLD"
"110528","Uses sign language","13o8M00","","CPRD_GOLD"
"110790","Does use hearing aid","2DH1.00","","CPRD_GOLD"
"111738","Requires information in Makaton","9NfL.00","","CPRD_GOLD"
"111739","Visual frame sign language interpreter needed","9NnR.00","","CPRD_GOLD"
"112690","Hands-on signing interpreter needed","9NnS.00","","CPRD_GOLD"
"115120","Using sign language to communicate with client","Z472900","","CPRD_GOLD"
