"MEDICAL_CODE_ID","DESCRIPTION","READ_CODE","SNOMED_CT_CODE","DATABASE"
"14G2.00","H/O: osteoarthritis","14G2.00","","IMRD"
"7P20400","Delivery of rehabilitation for osteoarthritis","7P20400","","IMRD"
"9hQ..00","Exception reporting: osteoarthritis quality indicators","9hQ..00","","IMRD"
"9hQ0.00","Excepted fr osteoarthritis quality indicators: pt unsuitable","9hQ0.00","","IMRD"
"9hQ1.00","Excepted osteoarthritis quality indicators: informed dissent","9hQ1.00","","IMRD"
"F163200","Myelopathy due to spondylosis","F163200","","IMRD"
"F337200","Nerve root and plexus compressions in spondylosis","F337200","","IMRD"
"N05..00","Osteoarthritis and allied disorders","N05..00","","IMRD"
"N05..11","Osteoarthritis","N05..11","","IMRD"
"N050.00","Generalised osteoarthritis - OA","N050.00","","IMRD"
"N050000","Generalised osteoarthritis of unspecified site","N050000","","IMRD"
"N050100","Generalised osteoarthritis of the hand","N050100","","IMRD"
"N050111","Heberdens' nodes","N050111","","IMRD"
"N050200","Generalised osteoarthritis of multiple sites","N050200","","IMRD"
"N050400","Primary generalized osteoarthrosis","N050400","","IMRD"
"N050500","Secondary multiple arthrosis","N050500","","IMRD"
"N050600","Erosive osteoarthrosis","N050600","","IMRD"
"N050700","Heberden's nodes with arthropathy","N050700","","IMRD"
"N050z00","Generalised osteoarthritis NOS","N050z00","","IMRD"
"N051.00","Localised, primary osteoarthritis","N051.00","","IMRD"
"N051000","Localised, primary osteoarthritis of unspecified site","N051000","","IMRD"
"N051100","Localised, primary osteoarthritis of the shoulder region","N051100","","IMRD"
"N051200","Localised, primary osteoarthritis of the upper arm","N051200","","IMRD"
"N051300","Localised, primary osteoarthritis of the forearm","N051300","","IMRD"
"N051400","Localised, primary osteoarthritis of the hand","N051400","","IMRD"
"N051500","Localised, primary osteoarthritis of the pelvic region/thigh","N051500","","IMRD"
"N051600","Localised, primary osteoarthritis of the lower leg","N051600","","IMRD"
"N051700","Localised, primary osteoarthritis of the ankle and foot","N051700","","IMRD"
"N051800","Localised, primary osteoarthritis of other specified site","N051800","","IMRD"
"N051900","Primary coxarthrosis, bilateral","N051900","","IMRD"
"N051B00","Primary gonarthrosis, bilateral","N051B00","","IMRD"
"N051C00","Primary arthrosis of first carpometacarpal joints, bilateral","N051C00","","IMRD"
"N051D00","Localised, primary osteoarthritis of the wrist","N051D00","","IMRD"
"N051E00","Localised, primary osteoarthritis of toe","N051E00","","IMRD"
"N051F00","Localised, primary osteoarthritis of elbow","N051F00","","IMRD"
"N051G00","Osteoarthritis of spinal facet joint","N051G00","","IMRD"
"N051z00","Localised, primary osteoarthritis NOS","N051z00","","IMRD"
"N052.00","Localised, secondary osteoarthritis","N052.00","","IMRD"
"N052000","Localised, secondary osteoarthritis of unspecified site","N052000","","IMRD"
"N052100","Localised, secondary osteoarthritis of the shoulder region","N052100","","IMRD"
"N052200","Localised, secondary osteoarthritis of the upper arm","N052200","","IMRD"
"N052300","Localised, secondary osteoarthritis of the forearm","N052300","","IMRD"
"N052400","Localised, secondary osteoarthritis of the hand","N052400","","IMRD"
"N052500","Localised, secondary osteoarthritis of pelvic region/thigh","N052500","","IMRD"
"N052511","Coxae malum senilis","N052511","","IMRD"
"N052600","Localised, secondary osteoarthritis of the lower leg","N052600","","IMRD"
"N052700","Localised, secondary osteoarthritis of the ankle and foot","N052700","","IMRD"
"N052800","Localised, secondary osteoarthritis of other specified site","N052800","","IMRD"
"N052900","Post-traumatic coxarthrosis, bilateral","N052900","","IMRD"
"N052A00","Post-traumatic gonarthrosis, bilateral","N052A00","","IMRD"
"N052B00","Post-traumatic arthrosis of first carpometacarpal jt bilat","N052B00","","IMRD"
"N052C00","Post-traumatic gonarthrosis, unilateral","N052C00","","IMRD"
"N052z00","Localised, secondary osteoarthritis NOS","N052z00","","IMRD"
"N053.00","Localised osteoarthritis, unspecified","N053.00","","IMRD"
"N053000","Localised osteoarthritis, unspecified, of unspecified site","N053000","","IMRD"
"N053100","Localised osteoarthritis, unspecified, of shoulder region","N053100","","IMRD"
"N053200","Localised osteoarthritis, unspecified, of the upper arm","N053200","","IMRD"
"N053300","Localised osteoarthritis, unspecified, of the forearm","N053300","","IMRD"
"N053400","Localised osteoarthritis, unspecified, of the hand","N053400","","IMRD"
"N053500","Localised osteoarthritis, unspecified, pelvic region/thigh","N053500","","IMRD"
"N053512","Hip osteoarthitis NOS","N053512","","IMRD"
"N053600","Localised osteoarthritis, unspecified, of the lower leg","N053600","","IMRD"
"N053611","Patellofemoral osteoarthritis","N053611","","IMRD"
"N053700","Localised osteoarthritis, unspecified, of the ankle and foot","N053700","","IMRD"
"N053800","Localised osteoarthritis, unspecified, of other spec site","N053800","","IMRD"
"N053900","Arthrosis of first carpometacarpal joint, unspecified","N053900","","IMRD"
"N053z00","Localised osteoarthritis, unspecified, NOS","N053z00","","IMRD"
"N054.00","Oligoarticular osteoarthritis, unspecified","N054.00","","IMRD"
"N054000","Oligoarticular osteoarthritis, unspec, of unspecified sites","N054000","","IMRD"
"N054100","Oligoarticular osteoarthritis, unspecified, of shoulder","N054100","","IMRD"
"N054200","Oligoarticular osteoarthritis, unspecified, of upper arm","N054200","","IMRD"
"N054300","Oligoarticular osteoarthritis, unspecified, of forearm","N054300","","IMRD"
"N054400","Oligoarticular osteoarthritis, unspecified, of hand","N054400","","IMRD"
"N054500","Oligoarticular osteoarthritis, unspecified, of pelvis/thigh","N054500","","IMRD"
"N054600","Oligoarticular osteoarthritis, unspecified, of lower leg","N054600","","IMRD"
"N054700","Oligoarticular osteoarthritis, unspecified, of ankle/foot","N054700","","IMRD"
"N054800","Oligoarticular osteoarthritis, unspecified, other spec sites","N054800","","IMRD"
"N054900","Oligoarticular osteoarthritis, unspecified, multiple sites","N054900","","IMRD"
"N054z00","Osteoarthritis of more than one site, unspecified, NOS","N054z00","","IMRD"
"N05z.00","Osteoarthritis NOS","N05z.00","","IMRD"
"N05z.11","Joint degeneration","N05z.11","","IMRD"
"N05z000","Osteoarthritis NOS, of unspecified site","N05z000","","IMRD"
"N05z100","Osteoarthritis NOS, of shoulder region","N05z100","","IMRD"
"N05z200","Osteoarthritis NOS, of the upper arm","N05z200","","IMRD"
"N05z211","Elbow osteoarthritis NOS","N05z211","","IMRD"
"N05z300","Osteoarthritis NOS, of the forearm","N05z300","","IMRD"
"N05z311","Wrist osteoarthritis NOS","N05z311","","IMRD"
"N05z400","Osteoarthritis NOS, of the hand","N05z400","","IMRD"
"N05z411","Finger osteoarthritis NOS","N05z411","","IMRD"
"N05z412","Thumb osteoarthritis NOS","N05z412","","IMRD"
"N05z500","Osteoarthritis NOS, pelvic region/thigh","N05z500","","IMRD"
"N05z511","Hip osteoarthritis NOS","N05z511","","IMRD"
"N05z600","Osteoarthritis NOS, of the lower leg","N05z600","","IMRD"
"N05z611","Knee osteoarthritis NOS","N05z611","","IMRD"
"N05z700","Osteoarthritis NOS, of ankle and foot","N05z700","","IMRD"
"N05z711","Ankle osteoarthritis NOS","N05z711","","IMRD"
"N05z712","Foot osteoarthritis NOS","N05z712","","IMRD"
"N05z713","Toe osteoarthritis NOS","N05z713","","IMRD"
"N05z800","Osteoarthritis NOS, other specified site","N05z800","","IMRD"
"N05z900","Osteoarthritis NOS, of shoulder","N05z900","","IMRD"
"N05zA00","Osteoarthritis NOS, of sternoclavicular joint","N05zA00","","IMRD"
"N05zB00","Osteoarthritis NOS, of acromioclavicular joint","N05zB00","","IMRD"
"N05zC00","Osteoarthritis NOS, of elbow","N05zC00","","IMRD"
"N05zD00","Osteoarthritis NOS, of distal radio-ulnar joint","N05zD00","","IMRD"
"N05zE00","Osteoarthritis NOS, of wrist","N05zE00","","IMRD"
"N05zF00","Osteoarthritis NOS, of MCP joint","N05zF00","","IMRD"
"N05zG00","Osteoarthritis NOS, of PIP joint of finger","N05zG00","","IMRD"
"N05zH00","Osteoarthritis NOS, of DIP joint of finger","N05zH00","","IMRD"
"N05zJ00","Osteoarthritis NOS, of hip","N05zJ00","","IMRD"
"N05zK00","Osteoarthritis NOS, of sacro-iliac joint","N05zK00","","IMRD"
"N05zL00","Osteoarthritis NOS, of knee","N05zL00","","IMRD"
"N05zM00","Osteoarthritis NOS, of tibio-fibular joint","N05zM00","","IMRD"
"N05zN00","Osteoarthritis NOS, of ankle","N05zN00","","IMRD"
"N05zP00","Osteoarthritis NOS, of subtalar joint","N05zP00","","IMRD"
"N05zQ00","Osteoarthritis NOS, of talonavicular joint","N05zQ00","","IMRD"
"N05zR00","Osteoarthritis NOS, of other tarsal joint","N05zR00","","IMRD"
"N05zS00","Osteoarthritis NOS, of 1st MTP joint","N05zS00","","IMRD"
"N05zT00","Osteoarthritis NOS, of lesser MTP joint","N05zT00","","IMRD"
"N05zU00","Osteoarthritis NOS, of IP joint of toe","N05zU00","","IMRD"
"N05zz00","Osteoarthritis NOS","N05zz00","","IMRD"
"N11..00","Spondylosis and allied disorders","N11..00","","IMRD"
"N11..12","Osteoarthritis of spine","N11..12","","IMRD"
"N110.00","Cervical spondylosis without myelopathy","N110.00","","IMRD"
"N110.11","Cervical spondylosis","N110.11","","IMRD"
"N110.12","Osteoarthritis cervical spine","N110.12","","IMRD"
"N110000","Single-level cervical spondylosis without myelopathy","N110000","","IMRD"
"N110100","Two-level cervical spondylosis without myelopathy","N110100","","IMRD"
"N110200","Multiple-level cervical spondylosis without myelopathy","N110200","","IMRD"
"N111.00","Cervical spondylosis with myelopathy","N111.00","","IMRD"
"N111000","Single-level cervical spondylosis with myelopathy","N111000","","IMRD"
"N111100","Two-level cervical spondylosis with myelopathy","N111100","","IMRD"
"N111200","Multiple-level cervical spondylosis with myelopathy","N111200","","IMRD"
"N112.00","Thoracic spondylosis without myelopathy","N112.00","","IMRD"
"N112.11","Thoracic spondylosis","N112.11","","IMRD"
"N112000","Single-level thoracic spondylosis without myelopathy","N112000","","IMRD"
"N112100","Two-level thoracic spondylosis without myelopathy","N112100","","IMRD"
"N112200","Multiple-level thoracic spondylosis without myelopathy","N112200","","IMRD"
"N112300","Dorsal spondylosis without myelopathy","N112300","","IMRD"
"N113.00","Thoracic spondylosis with myelopathy","N113.00","","IMRD"
"N113000","Single-level thoracic spondylosis with myelopathy","N113000","","IMRD"
"N113100","Two-level thoracic spondylosis with myelopathy","N113100","","IMRD"
"N113200","Multiple-level thoracic spondylosis with myelopathy","N113200","","IMRD"
"N114.00","Lumbosacral spondylosis without myelopathy","N114.00","","IMRD"
"N114.12","Lumbar spondylosis","N114.12","","IMRD"
"N114000","Single-level lumbosacral spondylosis without myelopathy","N114000","","IMRD"
"N114100","Two-level lumbosacral spondylosis without myelopathy","N114100","","IMRD"
"N114200","Multiple-level lumbosacral spondylosis without myelopathy","N114200","","IMRD"
"N115.00","Lumbosacral spondylosis with myelopathy","N115.00","","IMRD"
"N115000","Single-level lumbosacral spondylosis with myelopathy","N115000","","IMRD"
"N115100","Two-level lumbosacral spondylosis with myelopathy","N115100","","IMRD"
"N115200","Multiple-level lumbosacral spondylosis with myelopathy","N115200","","IMRD"
"N119.00","Cervical spondylosis with radiculopathy","N119.00","","IMRD"
"N119000","Single-level cervical spondylosis with radiculopathy","N119000","","IMRD"
"N119100","Two-level cervical spondylosis with radiculopathy","N119100","","IMRD"
"N119200","Multiple-level cervical spondylosis with radiculopathy","N119200","","IMRD"
"N11A.00","Cervical spondylosis with vascular compression","N11A.00","","IMRD"
"N11B.00","Thoracic spondylosis with radiculopathy","N11B.00","","IMRD"
"N11B000","Single-level thoracic spondylosis with radiculopathy","N11B000","","IMRD"
"N11B100","Two-level thoracic spondylosis with radiculopathy","N11B100","","IMRD"
"N11B200","Multiple-level thoracic spondylosis with radiculopathy","N11B200","","IMRD"
"N11C.00","Lumbosacral spondylosis with radiculopathy","N11C.00","","IMRD"
"N11C000","Single-level lumbosacral spondylosis with radiculopathy","N11C000","","IMRD"
"N11C100","Two-level lumbosacral spondylosis with radiculopathy","N11C100","","IMRD"
"N11C200","Multiple-level lumbosacral spondylosis with radiculopathy","N11C200","","IMRD"
"N11D.00","Osteoarthritis of spine","N11D.00","","IMRD"
"N11D000","Osteoarthritis of cervical spine","N11D000","","IMRD"
"N11D100","Osteoarthritis of thoracic spine","N11D100","","IMRD"
"N11D200","Osteoarthritis of lumbar spine","N11D200","","IMRD"
"N11D300","Osteoarthritis of spine NOS","N11D300","","IMRD"
"N11E.00","Cervical spondylosis","N11E.00","","IMRD"
"N11y.00","Other spondyloses and allied disorders","N11y.00","","IMRD"
"N11z.00","Spondylosis NOS","N11z.00","","IMRD"
"N11z.11","Osteoarthritis spine","N11z.11","","IMRD"
"N11z000","Spondylosis without myelopathy, NOS","N11z000","","IMRD"
"N11z100","Spondylosis with myelopathy, NOS","N11z100","","IMRD"
"N11zz00","Spondylosis NOS","N11zz00","","IMRD"
"Nyu2.00","[X]Arthrosis","Nyu2.00","","IMRD"
"Nyu2000","[X]Other polyarthrosis","Nyu2000","","IMRD"
"Nyu2100","[X]Other primary coxarthrosis","Nyu2100","","IMRD"
"Nyu2300","[X]Other post-traumatic coxarthrosis","Nyu2300","","IMRD"
"Nyu2400","[X]Other secondary coxarthrosis, bilateral","Nyu2400","","IMRD"
"Nyu2500","[X]Other primary gonarthrosis","Nyu2500","","IMRD"
"Nyu2511","[X] Unilateral primary gonarthrosis","Nyu2511","","IMRD"
"Nyu2600","[X]Other post-traumatic gonarthrosis","Nyu2600","","IMRD"
"Nyu2700","[X]Other secondary gonarthrosis, bilateral","Nyu2700","","IMRD"
"Nyu2800","[X]Other secondary gonarthrosis","Nyu2800","","IMRD"
"Nyu2811","[X] Unilateral secondary gonarthrosis","Nyu2811","","IMRD"
"Nyu2900","[X]Other primary arthrosis of first carpometacarpal joint","Nyu2900","","IMRD"
"Nyu2A00","[X]Other post-traumatic arthrosis/1st carpometacarpal joint","Nyu2A00","","IMRD"
"Nyu2B00","[X]Other 2ndry arthrosis/1st carpometacarpal joints,bilaterl","Nyu2B00","","IMRD"
"Nyu2C00","[X]Other secondary arthrosis of first carpometacarpal joint","Nyu2C00","","IMRD"
"Nyu2D00","[X]Other specified arthrosis","Nyu2D00","","IMRD"
"Nyu2E00","[X]Other secondary coxarthrosis","Nyu2E00","","IMRD"
"Nyu2E11","[X] Unilateral secondary coxarthrosis","Nyu2E11","","IMRD"
"Nyu2F00","[X]Post-traumatic arthrosis of other joints","Nyu2F00","","IMRD"
"Nyu6200","[X]Other spondylosis with myelopathy","Nyu6200","","IMRD"
"Nyu6300","[X]Other spondylosis with radiculopathy","Nyu6300","","IMRD"
"Nyu6400","[X]Other spondylosis","Nyu6400","","IMRD"
